[
  {
    "id": "fields-choked-with-growth",
    "name": "Fields Choked with Growth",
    "type": "unique",
    "sickSlug": "fields_choked_with_growth"
  },
  {
    "id": "stem-the-flow-of-fresh-water",
    "name": "Stem the Flow of Fresh Water",
    "type": "unique",
    "sickSlug": "stem_the_flow_of_fresh_water"
  },
  {
    "id": "gift-of-proliferation",
    "name": "Gift of Proliferation",
    "type": "unique",
    "sickSlug": "gift_of_proliferation"
  },
  {
    "id": "overgrow-in-a-night",
    "name": "Overgrow in a Night",
    "type": "unique",
    "sickSlug": "overgrow_in_a_night"
  },
  {
    "id": "reach-from-the-infinite-darkness",
    "name": "Reach from the Infinite Darkness",
    "type": "unique",
    "sickSlug": "reach_from_the_infinite_darkness"
  },
  {
    "id": "emerge-from-the-dread-night-wind",
    "name": "Emerge from the Dread Night Wind",
    "type": "unique",
    "sickSlug": "emerge_from_the_dread_night_wind"
  },
  {
    "id": "swallowed-by-the-endless-dark",
    "name": "Swallowed by the Endless Dark",
    "type": "unique",
    "sickSlug": "swallowed_by_the_endless_dark"
  },
  {
    "id": "terror-of-the-hunted",
    "name": "Terror of the Hunted",
    "type": "unique",
    "sickSlug": "terror_of_the_hunted"
  },
  {
    "id": "call-on-midnights-dream",
    "name": "Call on Midnight's Dream",
    "type": "unique",
    "sickSlug": "call_on_midnights_dream"
  },
  {
    "id": "dreams-of-the-dahan",
    "name": "Dreams of the Dahan",
    "type": "unique",
    "sickSlug": "dreams_of_the_dahan"
  },
  {
    "id": "predatory-nightmares",
    "name": "Predatory Nightmares",
    "type": "unique",
    "sickSlug": "predatory_nightmares"
  },
  {
    "id": "dread-apparitions",
    "name": "Dread Apparitions",
    "type": "unique",
    "sickSlug": "dread_apparitions"
  },
  {
    "id": "inspire-a-winding-dance",
    "name": "Inspire a Winding Dance",
    "type": "unique",
    "sickSlug": "inspire_a_winding_dance"
  },
  {
    "id": "exaltation-of-echoed-steps",
    "name": "Exaltation of Echoed Steps",
    "type": "unique",
    "sickSlug": "exaltation_of_echoed_steps"
  },
  {
    "id": "rumblings-portend-a-greater-quake",
    "name": "Rumblings Portend a Greater Quake",
    "type": "unique",
    "sickSlug": "rumblings_portend_a_greater_quake"
  },
  {
    "id": "radiating-tremors",
    "name": "Radiating Tremors",
    "type": "unique",
    "sickSlug": "radiating_tremors"
  },
  {
    "id": "gift-of-seismic-energy",
    "name": "Gift of Seismic Energy",
    "type": "unique",
    "sickSlug": "gift_of_seismic_energy"
  },
  {
    "id": "resounding-footfalls-sow-dismay",
    "name": "Resounding Footfalls Sow Dismay",
    "type": "unique",
    "sickSlug": "resounding_footfalls_sow_dismay"
  },
  {
    "id": "gift-of-furious-might",
    "name": "Gift of Furious Might",
    "type": "unique",
    "sickSlug": "gift_of_furious_might"
  },
  {
    "id": "herd-towards-the-lurking-maw",
    "name": "Herd Towards the Lurking Maw",
    "type": "unique",
    "sickSlug": "herd_towards_the_lurking_maw"
  },
  {
    "id": "ferocious-rampage",
    "name": "Ferocious Rampage",
    "type": "unique",
    "sickSlug": "ferocious_rampage"
  },
  {
    "id": "mark-territory-with-scars-and-teeth",
    "name": "Mark Territory with Scars and Teeth",
    "type": "unique",
    "sickSlug": "mark_territory_with_scars_and_teeth"
  },
  {
    "id": "unbearable-deluge",
    "name": "Unbearable Deluge",
    "type": "unique",
    "sickSlug": "unbearable_deluge"
  },
  {
    "id": "foundations-sink-into-mud",
    "name": "Foundations Sink into Mud",
    "type": "unique",
    "sickSlug": "foundations_sink_into_mud"
  },
  {
    "id": "gift-of-abundance",
    "name": "Gift of Abundance",
    "type": "unique",
    "sickSlug": "gift_of_abundance"
  },
  {
    "id": "dark-skies-loose-a-stinging-rain",
    "name": "Dark Skies Loose a Stinging Rain",
    "type": "unique",
    "sickSlug": "dark_skies_loose_a_stinging_rain"
  },
  {
    "id": "exaltation-of-grasping-roots",
    "name": "Exaltation of Grasping Roots",
    "type": "unique",
    "sickSlug": "exaltation_of_grasping_roots"
  },
  {
    "id": "terrifying-rampage",
    "name": "Terrifying Rampage",
    "type": "unique",
    "sickSlug": "terrifying_rampage"
  },
  {
    "id": "blazing-intimidation",
    "name": "Blazing Intimidation",
    "type": "unique",
    "sickSlug": "blazing_intimidation"
  },
  {
    "id": "surging-lahar",
    "name": "Surging Lahar",
    "type": "unique",
    "sickSlug": "surging_lahar"
  },
  {
    "id": "boon-of-watchful-guarding",
    "name": "Boon of Watchful Guarding",
    "type": "unique",
    "sickSlug": "boon_of_watchful_guarding"
  },
  {
    "id": "whispered-guidance-through-the-night",
    "name": "Whispered Guidance Through the Night",
    "type": "unique",
    "sickSlug": "whispered_guidance_through_the_night"
  },
  {
    "id": "mysterious-abductions",
    "name": "Mysterious Abductions",
    "type": "unique",
    "sickSlug": "mysterious_abductions"
  },
  {
    "id": "eerie-noises-and-moving-trees",
    "name": "Eerie Noises and Moving Trees",
    "type": "unique",
    "sickSlug": "eerie_noises_and_moving_trees"
  },
  {
    "id": "exaltation-of-tangled-growth",
    "name": "Exaltation of Tangled Growth",
    "type": "unique",
    "sickSlug": "exaltation_of_tangled_growth"
  },
  {
    "id": "foul-vapors-and-fetid-muck",
    "name": "Foul Vapors and Fetid Muck",
    "type": "unique",
    "sickSlug": "foul_vapors_and_fetid_muck"
  },
  {
    "id": "open-shifting-waterways",
    "name": "Open Shifting Waterways",
    "type": "unique",
    "sickSlug": "open_shifting_waterways"
  },
  {
    "id": "intractable-thickets-and-thorns",
    "name": "Intractable Thickets and Thorns",
    "type": "unique",
    "sickSlug": "intractable_thickets_and_thorns"
  },
  {
    "id": "travelers-boon",
    "name": "Traveler's Boon",
    "type": "unique",
    "sickSlug": "travelers_boon"
  },
  {
    "id": "paths-tied-by-nature",
    "name": "Paths Tied by Nature",
    "type": "unique",
    "sickSlug": "paths_tied_by_nature"
  },
  {
    "id": "a-circuitous-and-wending-journey",
    "name": "A Circuitous and Wending Journey",
    "type": "unique",
    "sickSlug": "a_circuitous_and_wending_journey"
  },
  {
    "id": "offer-passage-between-worlds",
    "name": "Offer Passage Between Worlds",
    "type": "unique",
    "sickSlug": "offer_passage_between_worlds"
  },
  {
    "id": "ways-of-shore-and-heartland",
    "name": "Ways of Shore and Heartland",
    "type": "unique",
    "sickSlug": "ways_of_shore_and_heartland"
  },
  {
    "id": "aid-from-the-spirit-speakers",
    "name": "Aid from the Spirit-Speakers",
    "type": "unique",
    "sickSlug": "aid_from_the_spiritspeakers"
  },
  {
    "id": "the-past-returns-again",
    "name": "The Past Returns Again",
    "type": "unique",
    "sickSlug": "the_past_returns_again"
  },
  {
    "id": "absolute-stasis",
    "name": "Absolute Stasis",
    "type": "unique",
    "sickSlug": "absolute_stasis"
  },
  {
    "id": "pour-time-sideways",
    "name": "Pour Time Sideways",
    "type": "unique",
    "sickSlug": "pour_time_sideways"
  },
  {
    "id": "blur-the-arc-of-years",
    "name": "Blur the Arc of Years",
    "type": "unique",
    "sickSlug": "blur_the_arc_of_years"
  },
  {
    "id": "unexpected-tigers",
    "name": "Unexpected Tigers",
    "type": "unique",
    "sickSlug": "unexpected_tigers"
  },
  {
    "id": "impersonate-authority",
    "name": "Impersonate Authority",
    "type": "unique",
    "sickSlug": "impersonate_authority"
  },
  {
    "id": "incite-the-mob",
    "name": "Incite the Mob",
    "type": "unique",
    "sickSlug": "incite_the_mob"
  },
  {
    "id": "overenthusiastic-arson",
    "name": "Overenthusiastic Arson",
    "type": "unique",
    "sickSlug": "overenthusiastic_arson"
  },
  {
    "id": "flames-fury",
    "name": "Flame's Fury",
    "type": "unique",
    "sickSlug": "flames_fury"
  },
  {
    "id": "threatening-flames",
    "name": "Threatening Flames",
    "type": "unique",
    "sickSlug": "threatening_flames"
  },
  {
    "id": "flash-fires",
    "name": "Flash-Fires",
    "type": "unique",
    "sickSlug": "flashfires"
  },
  {
    "id": "asphyxiating-smoke",
    "name": "Asphyxiating Smoke",
    "type": "unique",
    "sickSlug": "asphyxiating_smoke"
  },
  {
    "id": "surrounded-by-the-dahan",
    "name": "Surrounded by the Dahan",
    "type": "unique",
    "sickSlug": "surrounded_by_the_dahan"
  },
  {
    "id": "coordinated-raid",
    "name": "Coordinated Raid",
    "type": "unique",
    "sickSlug": "coordinated_raid"
  },
  {
    "id": "favors-of-story-and-season",
    "name": "Favors of Story and Season",
    "type": "unique",
    "sickSlug": "favors_of_story_and_season"
  },
  {
    "id": "call-to-vigilance",
    "name": "Call to Vigilance",
    "type": "unique",
    "sickSlug": "call_to_vigilance"
  },
  {
    "id": "regrow-from-roots",
    "name": "Regrow from Roots",
    "type": "unique",
    "sickSlug": "regrow_from_roots"
  },
  {
    "id": "boon-of-growing-power",
    "name": "Boon of Growing Power",
    "type": "unique",
    "sickSlug": "boon_of_growing_power"
  },
  {
    "id": "sacrosanct-wilderness",
    "name": "Sacrosanct Wilderness",
    "type": "unique",
    "sickSlug": "sacrosanct_wilderness"
  },
  {
    "id": "towering-wrath",
    "name": "Towering Wrath",
    "type": "unique",
    "sickSlug": "towering_wrath"
  },
  {
    "id": "harbingers-of-the-lightning",
    "name": "Harbingers of the Lightning",
    "type": "unique",
    "sickSlug": "harbingers_of_the_lightning"
  },
  {
    "id": "lightnings-boon",
    "name": "Lightning's Boon",
    "type": "unique",
    "sickSlug": "lightnings_boon"
  },
  {
    "id": "shatter-homesteads",
    "name": "Shatter Homesteads",
    "type": "unique",
    "sickSlug": "shatter_homesteads"
  },
  {
    "id": "raging-storm",
    "name": "Raging Storm",
    "type": "unique",
    "sickSlug": "raging_storm"
  },
  {